<?xml version="1.0" encoding="UTF-8" ?>
<package name="service-management" version="v0.1" xmlns:xsi="http://www.w3.org/2001/XMLSchema-instance"
         xsi:noNamespaceSchemaLocation="plugin-config-v2.xsd">

    <!-- 1.依赖分析 - 描述运行本插件包需要的其他插件包 -->
    <packageDependencies>
        <packageDependency name='xxx' version='1.0'/>
        <packageDependency name='xxx233' version='1.5'/>
    </packageDependencies>

    <!-- 2.菜单注入 - 描述运行本插件包需要注入的菜单 -->
    <menus>
        <menu code='JOBS_SERVICE_CATALOG_MANAGEMENT' cat='JOBS' displayName="Servive Catalog Management" cnDisplayName="服务类型管理">
            /service-catalog
        </menu>
        <menu code='JOBS_TASK_MANAGEMENT' cat='JOBS' displayName="Task Management" cnDisplayName="任务管理">/task-management</menu>
    </menus>

    <!-- 3.数据模型 - 描述本插件包的数据模型,并且描述和Framework数据模型的关系 -->

    <dataModel isDynamic="true" path="/data-model" method="GET">
        <entity name="service_catalogue" displayName="服务目录" description="服务目录模型">
            <attribute name="id" datatype="int" description="唯一ID"/>
            <attribute name="name" datatype="str" description="名字"/>
            <attribute name="status" datatype="str" description="状态"/>
        </entity>
        <entity name="service_pipeline" displayName="服务通道" description="服务通道模型">
            <attribute name="id" datatype="int" description="唯一ID"/>
            <attribute name="service_catalogue_id" datatype='ref' description="所属服务目录"
                       refPackage="service-management" refEntity="service_catalogue" ref="id"/>
            <attribute name="name" datatype="str" description="名字"/>
            <attribute name="owner_role_id" datatype="int" description="所属角色"/> <!--应该是ref到角色ID，目前暂无-->
            <attribute name="status" datatype="str" description="状态"/>
        </entity>
        <entity name="service_request_template" displayName="服务请求模板" description="服务请求模板模型">
            <attribute name="id" datatype="int" description="唯一ID"/>
            <attribute name="service_pipeline_id" datatype='ref' description="所属服务通道"
                       refPackage="service-management" refEntity="service_pipeline" ref="id"/>
            <attribute name="name" datatype="str" description="名字"/>
            <attribute name="process_defined_key" datatype="str" description="名字"/>
            <attribute name="status" datatype="str" description="状态"/>
        </entity>
        <entity name="service_request" displayName="服务请求" description="服务请求模型">
            <attribute name="id" datatype="int" description="唯一ID"/>
            <attribute name="template_id" datatype='ref' description="所属服务模板"
                       refPackage="service-management" refEntity="service_request_template" ref="id"/>
            <attribute name="reporter" datatype="str" description="上报人"/>
            <attribute name="reporter_role_id" datatype="str" description="上报角色ID"/>
            <attribute name="report_time" datatype="timestamp" description="上报时间"/>
            <attribute name="emergency" datatype="str" description="紧急程度"/>
            <attribute name="result" datatype="str" description="结果"/>
            <attribute name="process_instance_id" datatype="str" description="流程模板ID"/>
            <attribute name="status" datatype="str" description="状态"/>
        </entity>
        <entity name="task" displayName="任务" description="任务模型">
            <attribute name="id" datatype="int" description="唯一ID"/>
            <attribute name="service_request_id" datatype='ref' description="所属服务请求"
                       refPackage="service-management" refEntity="service_request" ref="id"/>
            <attribute name="process_instance_id" datatype="str" description="流程实例ID"/>
            <attribute name="callback_url" datatype="int" description="回调url"/>
            <attribute name="name" datatype="int" description="任务名称"/>
            <attribute name="process_definition_key" datatype="int" description="流程模板ID"/>
            <attribute name="reporter" datatype="str" description="上报人"/>
            <attribute name="report_time" datatype="timestamp" description="上报时间"/>
            <attribute name="operator_role_id" datatype="str" description="操作角色ID"/>
            <attribute name="operator" datatype="str" description="操作人"/>
            <attribute name="operator_time" datatype="timestamp" description="操作时间"/>
            <attribute name="input_parameters" datatype="int" description="输入参数"/>
            <attribute name="result" datatype="int" description="结果"/>
            <attribute name="result_message" datatype="int" description="处理结果"/>
            <attribute name="status" datatype="str" description="状态"/>
        </entity>
    </dataModel>
    <!-- 4.系统参数 - 描述运行本插件包需要的系统参数 -->
    <systemParameters>
        <systemParameter name="xxx" defaultValue='xxxx' scopeType="global"/>
        <systemParameter name="xxx" defaultValue='xxxx' scopeType="plugin-package"/>
    </systemParameters>

    <!-- 5.权限设定 -->
    <authorities>
        <authority systemRoleName="admin">
            <menu code="JOBS_SERVICE_CATALOG_MANAGEMENT"/>
            <menu code="JOBS_TASK_MANAGEMENT"/>
        </authority>
        <authority systemRoleName="wecube_operator">
            <menu code="JOBS_TASK_MANAGEMENT"/>
        </authority>
    </authorities>

    <!-- 6.运行资源 - 描述部署运行本插件包需要的基础资源(如主机、虚拟机、容器、数据库等) -->
    <resourceDependencies>
        <docker imageName="service_management" containerName="service_management" portBindings="22000:21000"
                volumeBindings=""
                envVariables="-e DATA_SOURCE_URL={%s} -e DB_USER={%s} -e DB_PWD={%s} -e CORE_ADDR={%s}"/>
        <mysql schema="service_management" initFileName="init.sql" upgradeFileName="upgrade.sql"/>
        <s3 bucketName="service_management"/>
    </resourceDependencies>

    <!-- 7.插件列表 - 描述插件包中单个插件的输入和输出 -->
    <plugins>
        <plugin name="task" package="service-management" entity="task">
            <interface action="create" path="/service-management/tasks" httpMethod='POST'>
                <inputParameters>
                    <parameter datatype="string" mappingType='system_variable' mappingSystemVariableName='1' required='Y'>
                        callbackUrl
                    </parameter>
                    <parameter datatype="string" mappingType='context' required='N'>description</parameter>
                    <parameter datatype="string" mappingType='context' required='Y'>name</parameter>
                    <parameter datatype="string" mappingType='entity' mappingEntityExpression='name_xxx' required='Y'>
                        operatorRoleId
                    </parameter>
                    <parameter datatype="string" mappingType='context' required='Y'>processDefinitionKey</parameter>
                    <parameter datatype="string" mappingType='context' required='Y'>processInstanceId</parameter>
                    <parameter datatype="string" mappingType='context' required='Y'>reporter</parameter>
                    <parameter datatype="string" mappingType='context' required='Y'>serviceRequestId</parameter>
                </inputParameters>
                <outputParameters>
                    <parameter datatype="string">status</parameter>
                    <parameter datatype="string">message</parameter>
                </outputParameters>
            </interface>
        </plugin>
        <plugin name="service_request" entity="service_request">
            <interface action="update" path="/service-management/service-requests/{service-request-id}/done"
                       httpMethod='PUT'>
                <inputParameters>
                    <parameter datatype="string" mappingType='system_variable' mappingSystemVariableName='1' required='Y'>
                        service-request-id
                    </parameter>
                    <parameter datatype="string" mappingType='context' required='Y'>result</parameter>
                </inputParameters>
                <outputParameters>
                    <parameter datatype="string">status</parameter>
                    <parameter datatype="string">message</parameter>
                </outputParameters>
            </interface>
        </plugin>
    </plugins>
</package>