<?xml version="1.0" encoding="UTF-8"?>
<package name="service-management" version="v0.1"
         xmlns:xsi="http://www.w3.org/2001/XMLSchema-instance"
         xsi:noNamespaceSchemaLocation="plugin-config-v2.xsd">

    <!-- 1.析 - 描述运行本插件包需要的其他插件包 -->
    <packageDependencies>
    </packageDependencies>

    <!-- 2.菜单注入 - 描述运行本插件包需要注入的菜单 -->
    <menus>
    </menus>

    <!-- 3.数据模型 - 描述本插件包的数据模型,并且描述和Framework数据模型的关系 -->
    <dataModel>
    </dataModel>

    <!-- 4.系统参数 - 描述运行本插件包需要的系统参数 -->
    <systemParameters>
    </systemParameters>

    <!-- 5.权限设定 -->
    <authorities>
    </authorities>

    <!-- 6.运行资源 - 描述部署运行本插件包需要的基础资源(如主机、虚拟机、容器、数据库等) -->
    <resourceDependencies>
        <docker imageName="service_management" containerName="service_management" portBindings="22000:21000" volumeBindings="" envVariables="-e DATA_SOURCE_URL={%s} -e DB_USER={%s} -e DB_PWD={%s} -e CORE_ADDR={%s}"/>
    </resourceDependencies>

    <!-- 7.插件列表 - 描述插件包中单个插件的输入和输出 -->
    <plugins>
    </plugins>
</package>