<?xml version="1.0" encoding="UTF-8"?>
<package name="wecmdb" version="v0.1"
         xmlns:xsi="http://www.w3.org/2001/XMLSchema-instance"
         xsi:noNamespaceSchemaLocation="plugin-config-v2.xsd">

    <!-- 1.依赖分析 - 描述运行本插件包需要的其他插件包 -->

    <!-- 2.菜单注入 - 描述运行本插件包需要注入的菜单 -->
    <menus>
        <menu code='DESIGNING_CI_DATA_ENQUIRY' cat='DESIGNING' displayName="CI Data Enquiry">/designing/ci-data-enquiry</menu>
        <menu code='DESIGNING_CI_INTEGRATED_QUERY_EXECUTION' cat='DESIGNING' displayName="CI Integrated Enquiry">/designing/ci-integrated-query-execution</menu>
        <menu code='DESIGNING_ENUM_ENQUIRY' cat='DESIGNING' displayName="Enum Enquiry">/designing/enum-enquiry</menu>

        <menu code='DESIGNING_CI_DATA_MANAGEMENT' cat='DESIGNING' displayName="CI Data Management">/designing/ci-data-management</menu>
        <menu code='DESIGNING_CI_INTEGRATED_QUERY_MANAGEMENT' cat='DESIGNING' displayName="CI Integrated Enquiry Management">/designing/ci-integrated-query-management</menu>
        <menu code='DESIGNING_ENUM_MANAGEMENT' cat='DESIGNING' displayName="Enum Management">/designing/enum-management</menu>

        <menu code='IDC_PLANNING_DESIGN' cat='DESIGNING' displayName="IDC Planning Design">/view-management/idc-planning-design</menu>
        <menu code='IDC_RESOURCE_PLANNING' cat='DESIGNING' displayName="IDC Resource Plan">/view-management/idc-resource-planning</menu>
        <menu code='APPLICATION_ARCHITECTURE_DESIGN' cat='DESIGNING' displayName="App Architecture Design">/view-management/application-architecture-design</menu>
        <menu code='APPLICATION_DEPLOYMENT_DESIGN' cat='DESIGNING' displayName="APP Deploy Design">/view-management/application-deployment-design</menu>

        <menu code='ADMIN_CMDB_MODEL_MANAGEMENT' cat='ADMIN' displayName="CMDB Model Management">/admin/cmdb-model-management</menu>
        <menu code='ADMIN_PERMISSION_MANAGEMENT' cat='ADMIN' displayName="Permission Management">/admin/permission-management</menu>
        <menu code='ADMIN_BASE_DATA_MANAGEMENT' cat='ADMIN' displayName="Base Data Management">/admin/base-data-management</menu>
        <menu code='ADMIN_QUERY_LOG' cat='ADMIN' displayName="Log Enquiry">/admin/query-log</menu>
        <menu code='ADMIN_USER_PASSWORD_MANAGEMENT' cat='ADMIN' displayName="User Password Management">/admin/user-password-management</menu>
    </menus>

    <!-- 3.数据模型 - 描述本插件包的数据模型,并且描述和Framework数据模型的关系 -->
    <dataModel isDynamic="true">
    </dataModel>

    <!-- 4.系统参数 - 描述运行本插件包需要的系统参数 -->
    <systemParameters>
        <systemParameter name="wecmdb-server-url" defaultValue='http://localhost:9080/wecmdb' scopeType="global"/>
    </systemParameters>

    <!-- 5.权限设定 -->
    <authorities>
        <authority systemRoleName="SUPER_ADMIN" >
            <menu code="DESIGNING_CI_DATA_ENQUIRY" />
            <menu code="DESIGNING_CI_INTEGRATED_QUERY_EXECUTION" />
            <menu code="DESIGNING_ENUM_ENQUIRY" />
            <menu code="DESIGNING_CI_DATA_MANAGEMENT" />
            <menu code="DESIGNING_CI_INTEGRATED_QUERY_MANAGEMENT" />
            <menu code="DESIGNING_ENUM_MANAGEMENT" />
            <menu code="IDC_PLANNING_DESIGN" />
            <menu code="IDC_RESOURCE_PLANNING" />
            <menu code="APPLICATION_ARCHITECTURE_DESIGN" />
            <menu code="APPLICATION_DEPLOYMENT_DESIGN" />
            <menu code="ADMIN_CMDB_MODEL_MANAGEMENT" />
            <menu code="ADMIN_PERMISSION_MANAGEMENT" />
            <menu code="ADMIN_BASE_DATA_MANAGEMENT" />
            <menu code="ADMIN_QUERY_LOG" />
            <menu code="ADMIN_USER_PASSWORD_MANAGEMENT" />
        </authority >
    </authorities>

    <!-- 6.运行资源 - 描述部署运行本插件包需要的基础资源(如主机、虚拟机、容器、数据库等) -->
    <resourceDependencies>
        <docker imageName="wecube-plugins-wecmdb" containerName="wecube-plugins-wecmdb" portBindings="22001:8081"/>
    </resourceDependencies>

    <!-- 7.插件列表 - 描述插件包中单个插件的输入和输出 -->
    <plugins>
        <plugin id="ci-data-confirm" name="CI Data Confirmation">
            <interface action="confirm" path="/data/confirm" httpMethod='POST'>
                <inputParameters>
                    <parameter datatype="string" mappingType='context' required='Y'>entityName</parameter>
                    <parameter datatype="string" mappingType='context' required='Y'>guid</parameter>
                </inputParameters>
                <outputParameters>
                    <parameter datatype="string">status</parameter>
                    <parameter datatype="string">message</parameter>
                    <parameter datatype="string">guid</parameter>
                    <parameter datatype="string">fixed_date</parameter>
                </outputParameters>
            </interface>
        </plugin>
    </plugins>
</package>